<!--
Copyright Â© 2003-2017 Unicode, Inc. and others. All rights reserved. Distributed under the Terms of Use in http://www.unicode.org/copyright.html.

Permission is hereby granted, free of charge, to any person obtaining a copy of the Unicode data files and any associated documentation (the "Data Files") or Unicode software and any associated documentation (the "Software") to deal in the Data Files or Software without restriction, including without limitation the rights to use, copy, modify, merge, publish, distribute, and/or sell copies of the Data Files or Software, and to permit persons to whom the Data Files or Software are furnished to do so, provided that (a) the above copyright notice(s) and this permission notice appear with all copies of the Data Files or Software, (b) both the above copyright notice(s) and this permission notice appear in associated documentation, and (c) there is clear notice in each modified Data File or in the Software as well as in the documentation associated with the Data File(s) or Software that the data or software has been modified.

THE DATA FILES AND SOFTWARE ARE PROVIDED "AS IS", WITHOUT WARRANTY OF ANY KIND, EXPRESS OR IMPLIED, INCLUDING BUT NOT LIMITED TO THE WARRANTIES OF MERCHANTABILITY, FITNESS FOR A PARTICULAR PURPOSE AND NONINFRINGEMENT OF THIRD PARTY RIGHTS. IN NO EVENT SHALL THE COPYRIGHT HOLDER OR HOLDERS INCLUDED IN THIS NOTICE BE LIABLE FOR ANY CLAIM, OR ANY SPECIAL INDIRECT OR CONSEQUENTIAL DAMAGES, OR ANY DAMAGES WHATSOEVER RESULTING FROM LOSS OF USE, DATA OR PROFITS, WHETHER IN AN ACTION OF CONTRACT, NEGLIGENCE OR OTHER TORTIOUS ACTION, ARISING OUT OF OR IN CONNECTION WITH THE USE OR PERFORMANCE OF THE DATA FILES OR SOFTWARE.

Except as contained in this notice, the name of a copyright holder shall not be used in advertising or otherwise to promote the sale, use or other dealings in these Data Files or Software without prior written authorization of the copyright holder.

    $Revision: 13338 $
-->

<!ELEMENT keyboard ( version, generation?, names, settings?, keyMap+, transforms? ) >
<!ATTLIST keyboard locale CDATA #REQUIRED >

<!ELEMENT version EMPTY >
<!ATTLIST version platform CDATA #REQUIRED >
    <!--@VALUE-->
<!ATTLIST version number CDATA #REQUIRED >
    <!--@METADATA-->
<!ATTLIST version cldrVersion CDATA #FIXED "32" >
    <!--@METADATA-->

<!ELEMENT generation EMPTY >
    <!--@DEPRECATED-->
<!ATTLIST generation date CDATA #REQUIRED >
    <!--@VALUE-->
    <!--@DEPRECATED-->

<!ELEMENT names ( name+ ) >

<!ELEMENT name EMPTY >
<!ATTLIST name value CDATA #REQUIRED >
    <!--@VALUE-->

<!ELEMENT settings EMPTY >
    <!--@ORDERED-->
<!ATTLIST settings fallback (omit) #IMPLIED >
    <!--@VALUE-->
<!ATTLIST settings transformFailure (omit) #IMPLIED >
    <!--@VALUE-->
<!ATTLIST settings transformPartial (hide) #IMPLIED >
    <!--@VALUE-->

<!ELEMENT keyMap ( map+ ) >
<!ATTLIST keyMap modifiers CDATA #IMPLIED >

<!ELEMENT map EMPTY >
<!ATTLIST map iso CDATA #REQUIRED >
<!ATTLIST map to CDATA #REQUIRED >
    <!--@VALUE-->
<!ATTLIST map longPress CDATA #IMPLIED >
    <!--@VALUE-->
<!ATTLIST map transform (no) #IMPLIED >
    <!--@VALUE-->

<!ELEMENT transforms ( transform+ ) >
<!ATTLIST transforms type CDATA #REQUIRED >

<!ELEMENT transform EMPTY >
<!ATTLIST transform from CDATA #REQUIRED >
<!ATTLIST transform to CDATA #REQUIRED >
    <!--@VALUE-->
