<?xml version="1.0" encoding="UTF-8" ?>
<!DOCTYPE keyboard SYSTEM "../dtd/ldmlKeyboard.dtd">
<keyboard locale="lv-t-k0-android">
	<version platform="4.4" number="$Revision: 11914 $"/>
	<names>
		<name value="Latvian"/>
	</names>
	<keyMap>
		<map iso="D01" to="q"/>
		<map iso="D02" to="w"/>
		<map iso="D03" to="e" longPress="ē ė è é ê ë ę ě"/>
		<map iso="D04" to="r" longPress="ŗ ř ŕ"/>
		<map iso="D05" to="t" longPress="ţ ť"/>
		<map iso="D06" to="y" longPress="ý ÿ"/>
		<map iso="D07" to="u" longPress="ū ų ù ú û ü ů ű"/>
		<map iso="D08" to="i" longPress="ī į ì í î ï ı"/>
		<map iso="D09" to="o" longPress="ò ó ô õ ö œ ő ø"/>
		<map iso="D10" to="p"/>
		<map iso="C01" to="a" longPress="ā à á â ã ä å æ ą"/>
		<map iso="C02" to="s" longPress="š ß ś ş"/>
		<map iso="C03" to="d" longPress="ď"/>
		<map iso="C04" to="f"/>
		<map iso="C05" to="g" longPress="ģ ğ"/>
		<map iso="C06" to="h"/>
		<map iso="C07" to="j"/>
		<map iso="C08" to="k" longPress="ķ"/>
		<map iso="C09" to="l" longPress="ļ ł ĺ ľ"/>
		<map iso="B01" to="z" longPress="ž ż ź"/>
		<map iso="B02" to="x"/>
		<map iso="B03" to="c" longPress="č ç ć"/>
		<map iso="B04" to="v"/>
		<map iso="B05" to="b"/>
		<map iso="B06" to="n" longPress="ņ ñ ń ń"/>
		<map iso="B07" to="m"/>
		<map iso="A02" to=","/> <!-- (key to left of space) -->
		<map iso="A03" to=" "/> <!-- space -->
		<map iso="A04" to="." longPress="# ! , ? - : ' @"/> <!-- (key to right of space) -->
	</keyMap>
	<keyMap modifiers="shift caps">
		<map iso="D01" to="Q"/>
		<map iso="D02" to="W"/>
		<map iso="D03" to="E" longPress="Ē Ė È É Ê Ë Ę Ě"/>
		<map iso="D04" to="R" longPress="Ŗ Ř Ŕ"/>
		<map iso="D05" to="T" longPress="Ţ Ť"/>
		<map iso="D06" to="Y" longPress="Ý Ÿ"/>
		<map iso="D07" to="U" longPress="Ū Ų Ù Ú Û Ü Ů Ű"/>
		<map iso="D08" to="I" longPress="Ī Į Ì Í Î Ï I"/>
		<map iso="D09" to="O" longPress="Ò Ó Ô Õ Ö Œ Ő Ø"/>
		<map iso="D10" to="P"/>
		<map iso="C01" to="A" longPress="Ā À Á Â Ã Ä Å Æ Ą"/>
		<map iso="C02" to="S" longPress="Š SS Ś Ş"/>
		<map iso="C03" to="D" longPress="Ď"/>
		<map iso="C04" to="F"/>
		<map iso="C05" to="G" longPress="Ģ Ğ"/>
		<map iso="C06" to="H"/>
		<map iso="C07" to="J"/>
		<map iso="C08" to="K" longPress="Ķ"/>
		<map iso="C09" to="L" longPress="Ļ Ł Ĺ Ľ"/>
		<map iso="B01" to="Z" longPress="Ž Ż Ź"/>
		<map iso="B02" to="X"/>
		<map iso="B03" to="C" longPress="Č Ç Ć"/>
		<map iso="B04" to="V"/>
		<map iso="B05" to="B"/>
		<map iso="B06" to="N" longPress="Ņ Ñ Ń Ń"/>
		<map iso="B07" to="M"/>
		<map iso="A02" to=","/> <!-- (key to left of space) -->
		<map iso="A03" to=" "/> <!-- space -->
		<map iso="A04" to="." longPress="# ! , ? - : ' @"/> <!-- (key to right of space) -->
	</keyMap>
	<keyMap modifiers="opt">
		<map iso="D01" to="1" longPress="¹ ½ ⅓ ¼ ⅛"/> <!-- Q -->
		<map iso="D02" to="2" longPress="² ⅔"/> <!-- W -->
		<map iso="D03" to="3" longPress="³ ¾ ⅜"/> <!-- E -->
		<map iso="D04" to="4" longPress="⁴"/> <!-- R -->
		<map iso="D05" to="5" longPress="⅝"/> <!-- T -->
		<map iso="D06" to="6"/> <!-- Y -->
		<map iso="D07" to="7" longPress="⅞"/> <!-- U -->
		<map iso="D08" to="8"/> <!-- I -->
		<map iso="D09" to="9"/> <!-- O -->
		<map iso="D10" to="0" longPress="ⁿ ∅"/> <!-- P -->
		<map iso="C01" to="@"/> <!-- A -->
		<map iso="C02" to="#"/> <!-- S -->
		<map iso="C03" to="$" longPress="¢ £ € ¥ ₱"/> <!-- D -->
		<map iso="C04" to="%" longPress="‰"/> <!-- F -->
		<map iso="C05" to="&amp;"/> <!-- G -->
		<map iso="C06" to="-" longPress="_ – — ·"/> <!-- H -->
		<map iso="C07" to="+" longPress="±"/> <!-- J -->
		<map iso="C08" to="(" longPress="&lt; { ["/> <!-- K -->
		<map iso="C09" to=")" longPress="&gt; } ]"/> <!-- L -->
		<map iso="B01" to="*" longPress="† ‡ ★"/> <!-- Z -->
		<map iso="B02" to="\u{22}" longPress="“ ” « »"/> <!-- X  to= "  -->
		<map iso="B03" to="&apos;" longPress="‘ ’ ‹ ›"/> <!-- C -->
		<map iso="B04" to=":"/> <!-- V -->
		<map iso="B05" to=";"/> <!-- B -->
		<map iso="B06" to="!" longPress="¡"/> <!-- N -->
		<map iso="B07" to="?" longPress="¿"/> <!-- M -->
		<map iso="A00" to="_"/> <!-- (3 keys to left of space) -->
		<map iso="A01" to="/"/> <!-- (2 keys to left of space) -->
		<map iso="A02" to=" "/> <!-- (key to left of space)  base=, -->
		<map iso="A03" to=","/> <!-- space -->
		<map iso="A04" to="." longPress="…"/> <!-- (key to right of space) -->
	</keyMap>
	<keyMap modifiers="opt+shift">
		<map iso="D01" to="~"/> <!-- Q -->
		<map iso="D02" to="`"/> <!-- W -->
		<map iso="D03" to="|"/> <!-- E -->
		<map iso="D04" to="•" longPress="♪ ♥ ♠ ♦ ♣"/> <!-- R -->
		<map iso="D05" to="√"/> <!-- T -->
		<map iso="D06" to="Π" longPress="π"/> <!-- Y -->
		<map iso="D07" to="÷"/> <!-- U -->
		<map iso="D08" to="×"/> <!-- I -->
		<map iso="D09" to="¶" longPress="§"/> <!-- O -->
		<map iso="D10" to="∆"/> <!-- P -->
		<map iso="C01" to="£"/> <!-- A -->
		<map iso="C02" to="¢"/> <!-- S -->
		<map iso="C03" to="€"/> <!-- D -->
		<map iso="C04" to="¥"/> <!-- F -->
		<map iso="C05" to="^" longPress="↑ ↓ ← →"/> <!-- G -->
		<map iso="C06" to="°" longPress="′ ″"/> <!-- H -->
		<map iso="C07" to="=" longPress="≠ ≈ ∞"/> <!-- J -->
		<map iso="C08" to="{"/> <!-- K -->
		<map iso="C09" to="}"/> <!-- L -->
		<map iso="B01" to="\"/> <!-- Z -->
		<map iso="B02" to="©"/> <!-- X -->
		<map iso="B03" to="®"/> <!-- C -->
		<map iso="B04" to="™"/> <!-- V -->
		<map iso="B05" to="℅"/> <!-- B -->
		<map iso="B06" to="["/> <!-- N -->
		<map iso="B07" to="]"/> <!-- M -->
		<map iso="A00" to="&lt;" longPress="‹ ≤ «"/> <!-- (3 keys to left of space) -->
		<map iso="A01" to="&gt;" longPress="› ≥ »"/> <!-- (2 keys to left of space) -->
		<map iso="A02" to=" "/> <!-- (key to left of space)  base=, -->
		<map iso="A03" to=","/> <!-- space -->
		<map iso="A04" to="." longPress="…"/> <!-- (key to right of space) -->
	</keyMap>
</keyboard>
