<?xml version="1.0" encoding="UTF-8"?>
<!DOCTYPE keyboard SYSTEM "../dtd/ldmlKeyboard.dtd">
<keyboard locale="dsb-t-k0-windows-legacy">
	<version platform="10" number="$Revision: 13265 $"/>
	<names>
		<name value="Sorbian Standard (Legacy)"/>
	</names>
	<settings fallback="omit" transformPartial="hide"/>
	<keyMap>
		<map iso="E00" to="^"/> <!-- ` -->
		<map iso="E01" to="1"/>
		<map iso="E02" to="2"/>
		<map iso="E03" to="3"/>
		<map iso="E04" to="4"/>
		<map iso="E05" to="5"/>
		<map iso="E06" to="6"/>
		<map iso="E07" to="7"/>
		<map iso="E08" to="8"/>
		<map iso="E09" to="9"/>
		<map iso="E10" to="0"/>
		<map iso="E11" to="ß"/> <!-- - -->
		<map iso="E12" to="´"/> <!-- = -->
		<map iso="D01" to="q"/>
		<map iso="D02" to="w"/>
		<map iso="D03" to="e"/>
		<map iso="D04" to="r"/>
		<map iso="D05" to="t"/>
		<map iso="D06" to="z"/> <!-- Y -->
		<map iso="D07" to="u"/>
		<map iso="D08" to="i"/>
		<map iso="D09" to="o"/>
		<map iso="D10" to="p"/>
		<map iso="D11" to="ü"/> <!-- [ -->
		<map iso="D12" to="+"/> <!-- ] -->
		<map iso="C01" to="a"/>
		<map iso="C02" to="s"/>
		<map iso="C03" to="d"/>
		<map iso="C04" to="f"/>
		<map iso="C05" to="g"/>
		<map iso="C06" to="h"/>
		<map iso="C07" to="j"/>
		<map iso="C08" to="k"/>
		<map iso="C09" to="l"/>
		<map iso="C10" to="ö"/> <!-- ; -->
		<map iso="C11" to="ä"/> <!-- ' -->
		<map iso="C12" to="ł"/> <!-- (key to right of ') -->
		<map iso="B00" to="&lt;"/> <!-- (key to left of Z) -->
		<map iso="B01" to="y"/> <!-- Z -->
		<map iso="B02" to="x"/>
		<map iso="B03" to="c"/>
		<map iso="B04" to="v"/>
		<map iso="B05" to="b"/>
		<map iso="B06" to="n"/>
		<map iso="B07" to="m"/>
		<map iso="B08" to=","/>
		<map iso="B09" to="."/>
		<map iso="B10" to="-"/> <!-- / -->
		<map iso="A03" to=" "/> <!-- space -->
	</keyMap>
	<keyMap modifiers="shift">
		<map iso="E00" to="°"/> <!-- `  base=^ -->
		<map iso="E01" to="!"/> <!-- 1 -->
		<map iso="E02" to="\u{22}"/> <!-- 2  to= "  -->
		<map iso="E03" to="§"/> <!-- 3 -->
		<map iso="E04" to="$"/> <!-- 4 -->
		<map iso="E05" to="%"/> <!-- 5 -->
		<map iso="E06" to="&amp;"/> <!-- 6 -->
		<map iso="E07" to="/"/> <!-- 7 -->
		<map iso="E08" to="("/> <!-- 8 -->
		<map iso="E09" to=")"/> <!-- 9 -->
		<map iso="E10" to="="/> <!-- 0 -->
		<map iso="E11" to="?"/> <!-- -  base=ß -->
		<map iso="E12" to="`"/> <!-- =  base=´ -->
		<map iso="D01" to="Q"/>
		<map iso="D02" to="W"/>
		<map iso="D03" to="E"/>
		<map iso="D04" to="R"/>
		<map iso="D05" to="T"/>
		<map iso="D06" to="Z"/> <!-- Y -->
		<map iso="D07" to="U"/>
		<map iso="D08" to="I"/>
		<map iso="D09" to="O"/>
		<map iso="D10" to="P"/>
		<map iso="D11" to="Ü"/> <!-- [ -->
		<map iso="D12" to="*"/> <!-- ]  base=+ -->
		<map iso="C01" to="A"/>
		<map iso="C02" to="S"/>
		<map iso="C03" to="D"/>
		<map iso="C04" to="F"/>
		<map iso="C05" to="G"/>
		<map iso="C06" to="H"/>
		<map iso="C07" to="J"/>
		<map iso="C08" to="K"/>
		<map iso="C09" to="L"/>
		<map iso="C10" to="Ö"/> <!-- ; -->
		<map iso="C11" to="Ä"/> <!-- ' -->
		<map iso="C12" to="Ł"/> <!-- (key to right of ') -->
		<map iso="B00" to="&gt;"/> <!-- (key to left of Z)  base=< -->
		<map iso="B01" to="Y"/> <!-- Z -->
		<map iso="B02" to="X"/>
		<map iso="B03" to="C"/>
		<map iso="B04" to="V"/>
		<map iso="B05" to="B"/>
		<map iso="B06" to="N"/>
		<map iso="B07" to="M"/>
		<map iso="B08" to=";"/> <!-- , -->
		<map iso="B09" to=":"/> <!-- . -->
		<map iso="B10" to="_"/> <!-- /  base=- -->
		<map iso="A03" to=" "/> <!-- space -->
	</keyMap>
	<keyMap modifiers="caps">
		<map iso="E00" to="^"/> <!-- ` -->
		<map iso="E01" to="!"/> <!-- 1 -->
		<map iso="E02" to="\u{22}"/> <!-- 2  to= "  -->
		<map iso="E03" to="§"/> <!-- 3 -->
		<map iso="E04" to="$"/> <!-- 4 -->
		<map iso="E05" to="%"/> <!-- 5 -->
		<map iso="E06" to="&amp;"/> <!-- 6 -->
		<map iso="E07" to="/"/> <!-- 7 -->
		<map iso="E08" to="("/> <!-- 8 -->
		<map iso="E09" to=")"/> <!-- 9 -->
		<map iso="E10" to="="/> <!-- 0 -->
		<map iso="E11" to="?"/> <!-- -  base=ß -->
		<map iso="E12" to="´"/> <!-- = -->
		<map iso="D01" to="Q"/>
		<map iso="D02" to="W"/>
		<map iso="D03" to="E"/>
		<map iso="D04" to="R"/>
		<map iso="D05" to="T"/>
		<map iso="D06" to="Z"/> <!-- Y -->
		<map iso="D07" to="U"/>
		<map iso="D08" to="I"/>
		<map iso="D09" to="O"/>
		<map iso="D10" to="P"/>
		<map iso="D11" to="Ü"/> <!-- [ -->
		<map iso="D12" to="*"/> <!-- ]  base=+ -->
		<map iso="C01" to="A"/>
		<map iso="C02" to="S"/>
		<map iso="C03" to="D"/>
		<map iso="C04" to="F"/>
		<map iso="C05" to="G"/>
		<map iso="C06" to="H"/>
		<map iso="C07" to="J"/>
		<map iso="C08" to="K"/>
		<map iso="C09" to="L"/>
		<map iso="C10" to="Ö"/> <!-- ; -->
		<map iso="C11" to="Ä"/> <!-- ' -->
		<map iso="C12" to="Ł"/> <!-- (key to right of ') -->
		<map iso="B00" to="&lt;"/> <!-- (key to left of Z) -->
		<map iso="B01" to="Y"/> <!-- Z -->
		<map iso="B02" to="X"/>
		<map iso="B03" to="C"/>
		<map iso="B04" to="V"/>
		<map iso="B05" to="B"/>
		<map iso="B06" to="N"/>
		<map iso="B07" to="M"/>
		<map iso="B08" to=";"/> <!-- , -->
		<map iso="B09" to=":"/> <!-- . -->
		<map iso="B10" to="-"/> <!-- / -->
		<map iso="A03" to=" "/> <!-- space -->
	</keyMap>
	<keyMap modifiers="caps+shift">
		<map iso="E00" to="°"/> <!-- `  base=^ -->
		<map iso="E01" to="1"/>
		<map iso="E02" to="2"/>
		<map iso="E03" to="3"/>
		<map iso="E04" to="4"/>
		<map iso="E05" to="5"/>
		<map iso="E06" to="6"/>
		<map iso="E07" to="7"/>
		<map iso="E08" to="8"/>
		<map iso="E09" to="9"/>
		<map iso="E10" to="0"/>
		<map iso="E11" to="ß"/> <!-- - -->
		<map iso="E12" to="`"/> <!-- =  base=´ -->
		<map iso="D01" to="q"/>
		<map iso="D02" to="w"/>
		<map iso="D03" to="e"/>
		<map iso="D04" to="r"/>
		<map iso="D05" to="t"/>
		<map iso="D06" to="z"/> <!-- Y -->
		<map iso="D07" to="u"/>
		<map iso="D08" to="i"/>
		<map iso="D09" to="o"/>
		<map iso="D10" to="p"/>
		<map iso="D11" to="ü"/> <!-- [ -->
		<map iso="D12" to="+"/> <!-- ] -->
		<map iso="C01" to="a"/>
		<map iso="C02" to="s"/>
		<map iso="C03" to="d"/>
		<map iso="C04" to="f"/>
		<map iso="C05" to="g"/>
		<map iso="C06" to="h"/>
		<map iso="C07" to="j"/>
		<map iso="C08" to="k"/>
		<map iso="C09" to="l"/>
		<map iso="C10" to="ö"/> <!-- ; -->
		<map iso="C11" to="ä"/> <!-- ' -->
		<map iso="C12" to="ł"/> <!-- (key to right of ') -->
		<map iso="B00" to="&gt;"/> <!-- (key to left of Z)  base=< -->
		<map iso="B01" to="y"/> <!-- Z -->
		<map iso="B02" to="x"/>
		<map iso="B03" to="c"/>
		<map iso="B04" to="v"/>
		<map iso="B05" to="b"/>
		<map iso="B06" to="n"/>
		<map iso="B07" to="m"/>
		<map iso="B08" to=","/>
		<map iso="B09" to="."/>
		<map iso="B10" to="_"/> <!-- /  base=- -->
		<map iso="A03" to=" "/> <!-- space -->
	</keyMap>
	<keyMap modifiers="altR+caps? ctrl+alt+caps?">
		<map iso="E01" to="»"/> <!-- 1 -->
		<map iso="E02" to="«"/> <!-- 2 -->
		<map iso="E03" to="„"/> <!-- 3 -->
		<map iso="E04" to="‚"/> <!-- 4 -->
		<map iso="E05" to="‘"/> <!-- 5 -->
		<map iso="E06" to="“"/> <!-- 6 -->
		<map iso="E07" to="{"/> <!-- 7 -->
		<map iso="E08" to="["/> <!-- 8 -->
		<map iso="E09" to="]"/> <!-- 9 -->
		<map iso="E10" to="}"/> <!-- 0 -->
		<map iso="E11" to="\"/> <!-- -  base=ß -->
		<map iso="D01" to="@"/> <!-- Q -->
		<map iso="D03" to="€"/> <!-- E -->
		<map iso="D12" to="~"/> <!-- ]  base=+ -->
		<map iso="C12" to="#"/> <!-- (key to right of ')  base=ł -->
		<map iso="B00" to="|"/> <!-- (key to left of Z)  base=< -->
		<map iso="B07" to="µ"/> <!-- M -->
	</keyMap>
	<keyMap modifiers="ctrl+caps?">
		<map iso="A03" to=" "/> <!-- space -->
	</keyMap>
	<transforms type="simple">
		<transform from="` " to="&apos;"/>
		<transform from="`a" to="à"/>
		<transform from="`A" to="À"/>
		<transform from="`c" to="ç"/>
		<transform from="`C" to="Ç"/>
		<transform from="`e" to="è"/>
		<transform from="`E" to="È"/>
		<transform from="`i" to="ì"/>
		<transform from="`I" to="Ì"/>
		<transform from="`o" to="ò"/>
		<transform from="`O" to="Ò"/>
		<transform from="`s" to="ş"/>
		<transform from="`S" to="Ş"/>
		<transform from="`u" to="ù"/>
		<transform from="`U" to="Ù"/>
		<transform from="´ " to="´"/>
		<transform from="´a" to="á"/>
		<transform from="´A" to="Á"/>
		<transform from="´c" to="ć"/>
		<transform from="´C" to="Ć"/>
		<transform from="´d" to="đ"/>
		<transform from="´D" to="Đ"/>
		<transform from="´e" to="é"/>
		<transform from="´E" to="É"/>
		<transform from="´i" to="í"/>
		<transform from="´I" to="Í"/>
		<transform from="´l" to="ĺ"/>
		<transform from="´L" to="Ĺ"/>
		<transform from="´n" to="ń"/>
		<transform from="´N" to="Ń"/>
		<transform from="´o" to="ó"/>
		<transform from="´O" to="Ó"/>
		<transform from="´r" to="ŕ"/>
		<transform from="´R" to="Ŕ"/>
		<transform from="´s" to="ś"/>
		<transform from="´S" to="Ś"/>
		<transform from="´u" to="ú"/>
		<transform from="´U" to="Ú"/>
		<transform from="´y" to="ý"/>
		<transform from="´Y" to="Ý"/>
		<transform from="´z" to="ź"/>
		<transform from="´Z" to="Ź"/>
		<transform from="^ " to="^"/>
		<transform from="^c" to="č"/>
		<transform from="^C" to="Č"/>
		<transform from="^d" to="ď"/>
		<transform from="^D" to="Ď"/>
		<transform from="^e" to="ě"/>
		<transform from="^E" to="Ě"/>
		<transform from="^l" to="ľ"/>
		<transform from="^L" to="Ľ"/>
		<transform from="^n" to="ň"/>
		<transform from="^N" to="Ň"/>
		<transform from="^o" to="Ô"/>
		<transform from="^O" to="ô"/>
		<transform from="^r" to="ř"/>
		<transform from="^R" to="Ř"/>
		<transform from="^s" to="š"/>
		<transform from="^S" to="Š"/>
		<transform from="^t" to="ť"/>
		<transform from="^T" to="Ť"/>
		<transform from="^z" to="ž"/>
		<transform from="^Z" to="Ž"/>
		<transform from="° " to="\u{307}"/>
		<transform from="°e" to="ė"/>
		<transform from="°E" to="Ė"/>
		<transform from="°s" to="ſ"/>
		<transform from="°u" to="ů"/>
		<transform from="°U" to="Ů"/>
		<transform from="°z" to="ż"/>
		<transform from="°Z" to="Ż"/>
	</transforms>
</keyboard>
